[
 {
  "id": "崇仁学案",
  "name": "崇仁学案",
  "order": 0,
  "founders": [
   "吴与弼"
  ],
  "members": [
   "吴与弼",
   "胡居仁",
   "娄谅",
   "谢复",
   "郑伉",
   "胡九韶",
   "魏校",
   "余佑",
   "夏尚朴",
   "潘润",
   "杨廉",
   "王应电",
   "王敬臣",
   "娄忱"
  ],
  "member_count": 14,
  "with_biography": 10
 },
 {
  "id": "白沙学案",
  "name": "白沙学案",
  "order": 1,
  "founders": [
   "陈献章"
  ],
  "members": [
   "陈献章",
   "李承箕",
   "张诩",
   "贺钦",
   "邹智",
   "陈茂烈",
   "林光",
   "陈庸",
   "李孔修",
   "谢佑",
   "何廷矩",
   "史桂芳"
  ],
  "member_count": 12,
  "with_biography": 12
 },
 {
  "id": "河东学案",
  "name": "河东学案",
  "order": 2,
  "founders": [
   "薛瑄",
   "吕柟"
  ],
  "members": [
   "薛瑄",
   "阎禹锡",
   "张鼎",
   "段坚",
   "张杰",
   "王鸿儒",
   "周蕙",
   "薛敬之",
   "李锦",
   "吕柟",
   "吕潜",
   "张节",
   "李挺",
   "郭蒙泉",
   "杨应诏",
   "王爵"
  ],
  "member_count": 16,
  "with_biography": 15
 },
 {
  "id": "三原学案",
  "name": "三原学案",
  "order": 3,
  "founders": [
   "王恕"
  ],
  "members": [
   "王恕",
   "王承裕",
   "马理",
   "韩邦奇",
   "杨爵",
   "王之士"
  ],
  "member_count": 6,
  "with_biography": 6
 },
 {
  "id": "姚江学案",
  "name": "姚江学案",
  "order": 4,
  "founders": [
   "王阳明"
  ],
  "members": [
   "王阳明",
   "许璋"
  ],
  "member_count": 2,
  "with_biography": 1
 },
 {
  "id": "浙中王门学案",
  "name": "浙中王门学案",
  "order": 5,
  "founders": [
   "徐爱",
   "王畿",
   "钱德洪"
  ],
  "members": [
   "徐爱",
   "蔡宗兖",
   "朱节",
   "钱德洪",
   "王畿",
   "季本",
   "黄绾",
   "董沄",
   "陆澄",
   "顾应祥",
   "黄宗明",
   "张元冲",
   "程文德",
   "徐用检",
   "万表",
   "王宗沐",
   "张元忭",
   "胡瀚",
   "应典",
   "周莹",
   "卢可久",
   "杜惟熙",
   "颜鲸",
   "董谷",
   "应良",
   "程粹",
   "陈时芳",
   "陈正道"
  ],
  "member_count": 28,
  "with_biography": 23
 },
 {
  "id": "江右王门学案",
  "name": "江右王门学案",
  "order": 6,
  "founders": [
   "邹守益",
   "欧阳德",
   "聂豹",
   "罗洪先"
  ],
  "members": [
   "邹守益",
   "欧阳德",
   "聂豹",
   "罗洪先",
   "刘文敏",
   "刘邦采",
   "刘阳",
   "刘晓",
   "刘魁",
   "黄弘纲",
   "何廷仁",
   "陈九川",
   "魏良弼",
   "魏良政",
   "魏良器",
   "王时槐",
   "邓以赞",
   "陈嘉谟",
   "刘元卿",
   "万廷言",
   "胡直",
   "邹元标",
   "罗大纮",
   "宋仪望",
   "邓元锡",
   "章潢",
   "冯应京",
   "刘秉监",
   "王钦",
   "欧阳瑜",
   "邹善",
   "邹德涵"
  ],
  "member_count": 32,
  "with_biography": 27
 },
 {
  "id": "南中王门学案",
  "name": "南中王门学案",
  "order": 7,
  "founders": [
   "黄省曾"
  ],
  "members": [
   "黄省曾",
   "周冲",
   "朱得之",
   "周怡",
   "薛应旗",
   "薛甲",
   "唐顺之",
   "唐鹤征",
   "徐阶",
   "杨豫孙",
   "蒋信",
   "冀元亨",
   "姜宝",
   "戚贤",
   "查铎",
   "殷迈",
   "程默",
   "贡安国"
  ],
  "member_count": 18,
  "with_biography": 12
 },
 {
  "id": "楚中王门学案",
  "name": "楚中王门学案",
  "order": 8,
  "founders": [
   "蒋信"
  ],
  "members": [
   "杨天游",
   "张棨",
   "戚衮",
   "沈宠",
   "程大宾",
   "章时鸾",
   "萧彦",
   "萧良干",
   "郑烛"
  ],
  "member_count": 9,
  "with_biography": 0
 },
 {
  "id": "北方王门学案",
  "name": "北方王门学案",
  "order": 9,
  "founders": [
   "穆孔晖"
  ],
  "members": [
   "穆孔晖",
   "张后觉",
   "孟秋",
   "尤时熙",
   "孟化鲤",
   "杨东明",
   "南大吉",
   "赵维新"
  ],
  "member_count": 8,
  "with_biography": 7
 },
 {
  "id": "粤闽王门学案",
  "name": "粤闽王门学案",
  "order": 10,
  "founders": [
   "薛侃"
  ],
  "members": [
   "薛侃",
   "周坦",
   "杨骥",
   "梁焯",
   "王明衡",
   "薛尚贤",
   "郑一初"
  ],
  "member_count": 7,
  "with_biography": 2
 },
 {
  "id": "止修学案",
  "name": "止修学案",
  "order": 11,
  "founders": [],
  "members": [
   "李材"
  ],
  "member_count": 1,
  "with_biography": 1
 },
 {
  "id": "泰州学案",
  "name": "泰州学案",
  "order": 12,
  "founders": [
   "王艮",
   "颜钧"
  ],
  "members": [
   "王艮",
   "王襞",
   "徐樾",
   "王栋",
   "林春",
   "赵贞吉",
   "罗汝芳",
   "杨起元",
   "耿定向",
   "耿定理",
   "焦竑",
   "潘士藻",
   "方学渐",
   "何祥",
   "祝世禄",
   "周汝登",
   "陶望龄",
   "刘塙",
   "夏廷美",
   "姚汝循",
   "方与时",
   "朱恕",
   "梁汝元",
   "程学颜",
   "管志道",
   "邓豁渠",
   "钱同文",
   "韩乐吾",
   "颜钧",
   "蔡悉"
  ],
  "member_count": 30,
  "with_biography": 18
 },
 {
  "id": "甘泉学案",
  "name": "甘泉学案",
  "order": 13,
  "founders": [
   "湛若水"
  ],
  "members": [
   "湛若水",
   "吕怀",
   "何迁",
   "洪垣",
   "唐枢",
   "蔡汝楠",
   "许孚远",
   "冯从吾",
   "唐伯元",
   "杨时乔",
   "王道",
   "丁元荐"
  ],
  "member_count": 12,
  "with_biography": 11
 },
 {
  "id": "蕺山学案",
  "name": "蕺山学案",
  "order": 14,
  "founders": [
   "刘宗周"
  ],
  "members": [
   "刘宗周"
  ],
  "member_count": 1,
  "with_biography": 1
 },
 {
  "id": "东林学案",
  "name": "东林学案",
  "order": 15,
  "founders": [],
  "members": [
   "顾宪成",
   "高攀龙",
   "钱一本",
   "孙慎行",
   "顾允成",
   "史孟鳞",
   "刘永澄",
   "薛敷教",
   "叶茂才",
   "许世卿",
   "耿橘",
   "刘元珍",
   "黄尊素",
   "吴钟峦",
   "华允诚",
   "陈龙正"
  ],
  "member_count": 16,
  "with_biography": 16
 },
 {
  "id": "诸儒学案",
  "name": "诸儒学案",
  "order": 16,
  "founders": [],
  "members": [
   "方孝孺",
   "赵谦",
   "曹端",
   "黄润玉",
   "罗伦",
   "章懋",
   "庄昶",
   "张元祯",
   "陈选",
   "陈真晟",
   "张吉",
   "周瑛",
   "蔡清",
   "潘府",
   "罗侨",
   "罗钦顺",
   "汪俊",
   "崔铣",
   "何瑭",
   "王廷相",
   "黄佐",
   "张邦奇",
   "张岳",
   "徐问",
   "李经纶",
   "李中",
   "霍韬",
   "薛蕙",
   "舒芬",
   "卢宁忠",
   "吕坤",
   "曹于汴",
   "吕维祺",
   "郝敬",
   "吴执御",
   "黄道周",
   "金铉",
   "金声",
   "朱天麟",
   "孙奇逢",
   "陈琛",
   "王宣",
   "易时中",
   "赵逮",
   "蔡烈",
   "林同",
   "邵宝",
   "王问"
  ],
  "member_count": 48,
  "with_biography": 40
 }
]